12211900,Fishtrap Creek at IB near Lynden WA,49.00261838,-122.4073816,WA,000,17110004,17,1711,,ST,Yes,Pacific Northwest,True,True
12212000,"FISHTRAP CREEK AT LYNDEN, WA",48.9642832,-122.4315504,WA,073,17110004,17,1711,22.3,ST,Yes,Pacific Northwest,True,True
12212050,"FISHTRAP CREEK AT FRONT STREET AT LYNDEN, WA",48.9386827,-122.4790353,WA,073,17110004,17,1711,37.8,ST,Yes,Pacific Northwest,True,True
12212100,"FISHTRAP CREEK AT FLYNN ROAD AT LYNDEN, WA",48.9265027,-122.4962765,WA,073,17110004,17,1711,38.1,ST,Yes,Pacific Northwest,True,True
12212200,"FISHTRAP CREEK AT RIVER ROAD NEAR LYNDEN, WA",48.91400196,-122.5207224,WA,073,17110004,17,1711,,ST,Yes,Pacific Northwest,True,True
12212430,"UNNAMED TRIB TO BERTRAND CR NR H ST NR LYNDEN, WA",48.99812708,-122.5012597,WA,073,17110004,17,1711,0.9,ST,Yes,Pacific Northwest,True,True
12212900,"TENMILE CREEK AT LAUREL, WA",48.86372287,-122.4971114,WA,073,17110004,17,1711,23.6,ST,Yes,Pacific Northwest,True,True
12213095,"NOOKSACK RIVER NEAR FERNDALE, WA",48.85372169,-122.5832272,WA,073,17110004,17,1711,786.0,ST,Yes,Pacific Northwest,True,True
12213100,"NOOKSACK RIVER AT FERNDALE, WA",48.84479237,-122.5893141,WA,073,17110004,17,1711,786.0,ST,Yes,Pacific Northwest,True,True
12213140,"NOOKSACK RIVER AT BRENNAN, WA",48.81927627,-122.5798947,WA,073,17110004,17,1711,785.0,ST,Yes,Pacific Northwest,True,True
12214000,"DAKOTA CREEK NEAR BLAINE, WA",48.9567791,-122.6596165,WA,073,17110002,17,1711,18.4,ST,Yes,Pacific Northwest,True,True
12214300,"SUMAS RIVER AT MASSEY ROAD NEAR NOOKSACK, WA",48.9056727,-122.3176582,WA,073,17110001,17,1711,8.6,ST,Yes,Pacific Northwest,True,True
12214350,"SUMAS RIVER AT SOUTH PASS ROAD AT NOOKSACK, WA",48.9201177,-122.3140465,WA,073,17110001,17,1711,15.9,ST,Yes,Pacific Northwest,True,True
12214500,"SUMAS RIVER NEAR SUMAS, WA",48.9748433,-122.2512642,WA,073,17110001,17,1711,31.0,ST,Yes,Pacific Northwest,True,True
12396000,"CALISPELL CREEK NEAR DALKENA, WA",48.2443466,-117.3416097,WA,051,17010216,17,1701,68.3,ST,Yes,Pacific Northwest,True,True
12396500,"PEND OREILLE RIVER BELOW BOX CANYON NEAR IONE, WA",48.7809561,-117.4163706,WA,051,17010216,17,1701,24900.0,ST,Yes,Pacific Northwest,True,True
12396900,"SULLIVAN CREEK AB OUTLET CR NR METALINE FALLS, WA",48.8463111,-117.2869086,WA,051,17010216,17,1701,70.2,ST,Yes,Pacific Northwest,True,True
12397100,"OUTLET CREEK NEAR METALINE FALLS, WA",48.84492215,-117.2877419,WA,051,17010216,17,1701,51.5,ST,Yes,Pacific Northwest,True,True
12397500,"SULLIVAN CREEK NEAR METALINE FALLS, WA",48.8527001,-117.2899644,WA,051,17010216,17,1701,122.0,ST,Yes,Pacific Northwest,True,True
12398000,"SULLIVAN CREEK AT METALINE FALLS, WA",48.8601981,-117.364133,WA,051,17010216,17,1701,142.0,ST,Yes,Pacific Northwest,True,True
12398090,"PEND OREILLE RIVER AT METALINE FALLS, WA",48.86519798,-117.3733,WA,051,17010216,17,1701,,ST,Yes,Pacific Northwest,True,True
12398500,"PEND OREILLE RIVER BL Z CNYN NR METALINE FALLS, WA",48.9804804,-117.3455234,WA,051,17010216,17,1701,25200.0,ST,Yes,Pacific Northwest,True,True
12398600,PEND OREILLE RIVER AT INTERNATIONAL BOUNDARY,48.99881409,-117.3535794,WA,051,17010216,17,1701,25200.0,ST,Yes,Pacific Northwest,True,True
12399500,COLUMBIA RIVER AT INTERNATIONAL BOUNDARY,49.00074966,-117.6294206,WA,065,17020001,17,1702,59700.0,ST,Yes,Pacific Northwest,True,True
12399510,COLUMBIA RIVER AUX GAGE AT INTERNATIONAL BOUNDARY,48.97130417,-117.6410879,WA,065,17020001,17,1702,59700.0,ST,Yes,Pacific Northwest,True,True
12399600,"DEEP CREEK NEAR NORTHPORT, WA",48.92963378,-117.7508158,WA,065,17020001,17,1702,191.0,ST,Yes,Pacific Northwest,True,True
12400000,"SHEEP CREEK NEAR VELVET, WA",48.952689,-117.8816551,WA,065,17020001,17,1702,171.0,ST,Yes,Pacific Northwest,True,True
12400500,"SHEEP CREEK NEAR NORTHPORT, WA",48.944356,-117.7816504,WA,065,17020001,17,1702,225.0,ST,Yes,Pacific Northwest,True,True
12400520,"COLUMBIA RIVER AT NORTHPORT, WA",48.91880008,-117.787484,WA,065,17020001,17,1702,60200.0,ST,Yes,Pacific Northwest,True,True
12400900,"MYERS CREEK NEAR CHESAW, WA",48.99851436,-119.0200417,WA,047,17020002,17,1702,90.9,ST,Yes,Pacific Northwest,True,True
12401500,"KETTLE RIVER NEAR FERRY, WA",48.98128428,-118.7664259,WA,019,17020002,17,1702,2200.0,ST,Yes,Pacific Northwest,True,True
12402500,"CURLEW CREEK NEAR MALO, WA",48.7665554,-118.6539149,WA,019,17020002,17,1702,66.8,ST,Yes,Pacific Northwest,True,True
12403000,"CURLEW CREEK NEAR CURLEW, WA",48.77350027,-118.6469703,WA,019,17020002,17,1702,,ST,Yes,Pacific Northwest,True,True
12404500,"KETTLE RIVER NEAR LAURIER, WA",48.9842824,-118.216401,WA,019,17020002,17,1702,3800.0,ST,Yes,Pacific Northwest,True,True
12404900,"KETTLE RIVER NEAR BARSTOW, WA",48.7846261,-118.125273,WA,065,17020002,17,1702,4044.0,ST,Yes,Pacific Northwest,True,True
12405000,"KETTLE RIVER AT BOYDS, WA",48.72212507,-118.1233268,WA,019,17020002,17,1702,4070.0,ST,Yes,Pacific Northwest,True,True
12405500,"COLUMBIA RIVER AT KETTLE FALLS, WA",48.6221233,-118.1177701,WA,019,17020001,17,1702,64500.0,ST,Yes,Pacific Northwest,True,True
12407000,"SHEEP CREEK AT LOON LAKE, WA",48.0596156,-117.6538451,WA,065,17020003,17,1702,37.9,ST,Yes,Pacific Northwest,True,True
12407500,"SHEEP CREEK AT SPRINGDALE, WA",48.05767008,-117.7521827,WA,065,17020003,17,1702,48.2,ST,Yes,Pacific Northwest,True,True
12407520,"DEER CREEK NEAR VALLEY, WA",48.11822637,-117.7988537,WA,065,17020003,17,1702,36.0,ST,Yes,Pacific Northwest,True,True
12407700,"CHEWELAH CREEK AT CHEWELAH, WA",48.2832316,-117.7149655,WA,065,17020003,17,1702,94.1,ST,Yes,Pacific Northwest,True,True
12408000,"COLVILLE RIVER AT BLUE CREEK, WA",48.31934236,-117.8205275,WA,065,17020003,17,1702,428.0,ST,Yes,Pacific Northwest,True,True
12408300,"LITTLE PEND OREILLE RIVER NEAR COLVILLE, WA",48.46601359,-117.7491406,WA,065,17020003,17,1702,132.0,ST,Yes,Pacific Northwest,True,True
12408420,"HALLER CREEK NEAR ARDEN, WA",48.4671231,-117.9077576,WA,065,17020003,17,1702,37.0,ST,Yes,Pacific Northwest,True,True
12408500,"MILL CREEK NEAR COLVILLE, WA",48.5787928,-117.8666478,WA,065,17020003,17,1702,83.0,ST,Yes,Pacific Northwest,True,True
12408700,"MILL CREEK AT MOUTH NEAR COLVILLE, WA",48.5735141,-117.9441498,WA,065,17020003,17,1702,146.0,ST,Yes,Pacific Northwest,True,True
12409000,"COLVILLE RIVER AT KETTLE FALLS, WA",48.5943461,-118.0624887,WA,065,17020003,17,1702,1007.0,ST,Yes,Pacific Northwest,True,True
12409500,"HALL CREEK AT INCHELIUM, WA",48.311281,-118.2119375,WA,019,17020001,17,1702,161.0,ST,Yes,Pacific Northwest,True,True
12410000,"STRANGER CREEK AT METEOR, WA",48.2610009,-118.2844407,WA,019,17020001,17,1702,50.9,ST,Yes,Pacific Northwest,True,True
12410500,"STRANGER CREEK AT INCHELIUM, WA",48.2921142,-118.1899912,WA,019,17020001,17,1702,80.2,ST,Yes,Pacific Northwest,True,True
12419500,"Spokane R ab Liberty Bridge nr Otis Orchard, WA",47.6985113,-117.0440885,WA,063,17010305,17,1701,3880.0,ST,Yes,Pacific Northwest,True,True
12420500,"SPOKANE RIVER AT GREENACRES, WA",47.6773972,-117.1521484,WA,063,17010305,17,1701,4150.0,ST,Yes,Pacific Northwest,True,True
12421000,"SPOKANE RIVER AT TRENT, WA",47.688784,-117.2260416,WA,063,17010305,17,1701,4210.0,ST,Yes,Pacific Northwest,True,True
12421500,"SPOKANE RIVER BELOW TRENT BRIDGE NEAR SPOKANE, WA",47.69711678,-117.2440984,WA,063,17010305,17,1701,4200.0,ST,Yes,Pacific Northwest,True,True
12422000,"SPOKANE RIVER BELOW N GREENE ST AT SPOKANE, WA",47.67905905,-117.3646571,WA,063,17010305,17,1701,4220.0,ST,Yes,Pacific Northwest,True,True
12422500,"Spokane River at Spokane, WA",47.6593354,-117.4491029,WA,063,17010305,17,1701,4290.0,ST,Yes,Pacific Northwest,True,True
12422990,"HANGMAN CREEK AT STATE LINE ROAD NEAR TEKOA, WA",47.2026758,-117.0407304,WA,075,17010306,17,1701,127.0,ST,Yes,Pacific Northwest,True,True
12424000,"Hangman Creek at Spokane, WA",47.6526688,-117.449658,WA,063,17010306,17,1701,689.0,ST,Yes,Pacific Northwest,True,True
12424003,"HANGMAN CREEK AT MOUTH AT SPOKANE, WA",47.65461317,-117.4543805,WA,063,17010306,17,1701,689.0,ST,Yes,Pacific Northwest,True,True
12424200,"SPOKANE R AT RIVERSIDE STATE PARK AT SPOKANE, WA",47.69655647,-117.4977183,WA,063,17010307,17,1701,5010.0,ST,Yes,Pacific Northwest,True,True
12424500,"Spokane River at 7 Mile Bridge near Spokane, WA",47.740167,-117.5204998,WA,063,17010307,17,1701,5020.0,ST,Yes,Pacific Northwest,True,True
12426000,"SPOKANE RIVER BELOW NINE MILE DAM AT SPOKANE, WA",47.78044505,-117.5455016,WA,063,17010307,17,1701,5220.0,ST,Yes,Pacific Northwest,True,True
12427000,"LITTLE SPOKANE RIVER AT ELK, WA",48.0221196,-117.2729919,WA,063,17010308,17,1701,115.0,ST,Yes,Pacific Northwest,True,True
12431000,"LITTLE SPOKANE RIVER AT DARTFORD, WA",47.78461388,-117.4043856,WA,063,17010308,17,1701,665.0,ST,Yes,Pacific Northwest,True,True
12431500,"LITTLE SPOKANE RIVER NEAR DARTFORD, WA",47.78100099,-117.4963338,WA,063,17010308,17,1701,698.0,ST,Yes,Pacific Northwest,True,True
12431900,"LITTLE SPOKANE RIVER NEAR MOUTH NEAR SPOKANE, WA",47.78322298,-117.529668,WA,063,17010308,17,1701,700.0,ST,Yes,Pacific Northwest,True,True
12433000,"SPOKANE RIVER AT LONG LAKE, WA",47.8365534,-117.8413478,WA,065,17010307,17,1701,6020.0,ST,Yes,Pacific Northwest,True,True
12433100,"CHAMOKANE CREEK NEAR SPRINGDALE, WA",47.9946133,-117.7263464,WA,065,17010307,17,1701,99.9,ST,Yes,Pacific Northwest,True,True
12433200,"CHAMOKANE CREEK BELOW FALLS NEAR LONG LAKE, WA",47.8632201,-117.858294,WA,065,17010307,17,1701,179.0,ST,Yes,Pacific Northwest,True,True
12433500,"SPOKANE RIVER BL LITTLE FALLS NEAR LONG LAKE, WA",47.8248842,-117.9413544,WA,043,17010307,17,1701,6220.0,ST,Yes,Pacific Northwest,True,True
12433542,"BLUE CR AB MIDNITE MINE DRAINAGE NR WELLPINIT, WA",47.9243282,-118.0894203,WA,065,17010307,17,1701,6.0,ST,Yes,Pacific Northwest,True,True
12433556,"MIDNITE MINE DRAINAGE NEAR WELLPINIT, WA",47.9240504,-118.0899759,WA,065,17010307,17,1701,1.3,ST,Yes,Pacific Northwest,True,True
12433558,"BLUE CR BL MIDNITE MINE DRAINAGE NR WELLPINIT, WA",47.92321708,-118.0899759,WA,065,17010307,17,1701,7.3,ST,Yes,Pacific Northwest,True,True
12433561,"BLUE CREEK NEAR MOUTH NEAR WELLPINIT, WA",47.8968272,-118.1358112,WA,065,17010307,17,1701,19.1,ST,Yes,Pacific Northwest,True,True
12433890,"SANPOIL RIVER AB 13 MILE CREEK NEAR REPUBLIC, WA",48.47738367,-118.7300255,WA,019,17020004,17,1702,263.0,ST,Yes,Pacific Northwest,True,True
12434110,"WEST FORK SANPOIL RIVER NEAR REPUBLIC, WA",48.4587718,-118.7516928,WA,019,17020004,17,1702,308.0,ST,Yes,Pacific Northwest,True,True
12434500,"SANPOIL RIVER NEAR KELLER, WA",48.10765829,-118.698625,WA,019,17020004,17,1702,880.0,ST,Yes,Pacific Northwest,True,True
12434590,"SANPOIL RIVER ABOVE JACK CREEK AT KELLER, WA",48.08432459,-118.6914018,WA,019,17020004,17,1702,900.0,ST,Yes,Pacific Northwest,True,True
12435000,"SANPOIL RIVER AT KELLER, WA",48.0346017,-118.6655659,WA,019,17020004,17,1702,928.0,ST,Yes,Pacific Northwest,True,True
12435500,"FEEDER CANAL AT GRAND COULEE, WA",47.9512632,-118.995577,WA,043,17020001,17,1702,,ST-CA,Yes,Pacific Northwest,True,True
12435810,"SCBID EL85 XX WASTEWAY NEAR MESA, WA",46.59458337,-118.9919504,WA,021,17020016,17,1702,,ST,Yes,Pacific Northwest,True,True
12435840,"SCBID EL85 JJ LATERAL AT HEAD NEAR MESA, WA",46.63458375,-118.9900059,WA,021,17020016,17,1702,,ST,Yes,Pacific Northwest,True,True
12435850,"SCBID EL85 CANAL BL EL85 JJ LATERAL NEAR MESA, WA",46.6348615,-118.9905614,WA,021,17020016,17,1702,,ST-CA,Yes,Pacific Northwest,True,True
12436500,"COLUMBIA RIVER AT GRAND COULEE, WA",47.9654302,-118.9827992,WA,047,17020005,17,1702,74700.0,ST,Yes,Pacific Northwest,True,True
12437000,"NESPELEM CANAL NEAR NESPELEM, WA",48.1765449,-118.9828036,WA,047,17020005,17,1702,,ST-CA,Yes,Pacific Northwest,True,True
12437500,"NESPELEM RIVER AT NESPELEM, WA",48.1762671,-118.982248,WA,047,17020005,17,1702,122.0,ST,Yes,Pacific Northwest,True,True
12437505,"NESPELEM RIVER BELOW MILLPOND AT NESPELEM, WA",48.16515585,-118.980581,WA,047,17020005,17,1702,123.0,ST,Yes,Pacific Northwest,True,True
12438000,"COLUMBIA RIVER AT BRIDGEPORT, WA",48.0065333,-119.6653303,WA,017,17020005,17,1702,75700.0,ST,Yes,Pacific Northwest,True,True
12438900,"NINEMILE CREEK NEAR OROVILLE, WA",48.9698886,-119.4056188,WA,047,17020006,17,1702,46.9,ST,Yes,Pacific Northwest,True,True
12438905,"NINEMILE CREEK AT EASTLAKE RD NEAR OROVILLE, WA",48.9703694,-119.4185194,WA,047,17020006,17,1702,47.1,ST,Yes,Pacific Northwest,True,True
12439300,"TONASKET CREEK AT OROVILLE, WA",48.94294189,-119.4136748,WA,047,17020006,17,1702,60.1,ST,Yes,Pacific Northwest,True,True
12439500,"OKANOGAN RIVER AT OROVILLE, WA",48.9307184,-119.4203419,WA,047,17020006,17,1702,3195.0,ST,Yes,Pacific Northwest,True,True
12440000,"SINLAHEKIN CREEK ABOVE BLUE LAKE NEAR LOOMIS, WA",48.6915377,-119.717849,WA,047,17020007,17,1702,41.7,ST,Yes,Pacific Northwest,True,True
12441000,"SINLAHEKIN CREEK AT TWIN BRIDGE NEAR LOOMIS, WA",48.7359825,-119.6734047,WA,047,17020007,17,1702,75.5,ST,Yes,Pacific Northwest,True,True
12441500,"SINLAHEKIN CREEK NEAR LOOMIS, WA",48.78042809,-119.651183,WA,047,17020007,17,1702,86.0,ST,Yes,Pacific Northwest,True,True
12442000,"TOATS COULEE CREEK NEAR LOOMIS, WA",48.8340404,-119.6967417,WA,047,17020007,17,1702,130.0,ST,Yes,Pacific Northwest,True,True
12442200,"WHITESTONE IRRIGATION CANAL NEAR LOOMIS, WA",48.83126278,-119.6703518,WA,047,17020007,17,1702,,ST-CA,Yes,Pacific Northwest,True,True
12442300,"SINLAHEKIN CREEK AB CHOPAKA CREEK NEAR LOOMIS, WA",48.8526525,-119.6484071,WA,047,17020007,17,1702,256.0,ST,Yes,Pacific Northwest,True,True
12442500,"SIMILKAMEEN RIVER NEAR NIGHTHAWK, WA",48.98460109,-119.6184098,WA,047,17020007,17,1702,3550.0,ST,Yes,Pacific Northwest,True,True
12443000,"OROVILLE TONASKET I.D. CANAL NR OROVILLE, WA",48.94988169,-119.4678466,WA,047,17020007,17,1702,,ST-CA,Yes,Pacific Northwest,True,True
12443500,"SIMILKAMEEN RIVER NEAR OROVILLE, WA",48.96099,-119.5011834,WA,047,17020007,17,1702,3580.0,ST,Yes,Pacific Northwest,True,True
12443600,"SIMILKAMEEN RIVER AT OROVILLE, WA",48.9346056,-119.4420105,WA,047,17020007,17,1702,3550.0,ST,Yes,Pacific Northwest,True,True
12444100,"WHITESTONE CREEK NEAR TONASKET, WA",48.78459897,-119.434507,WA,047,17020006,17,1702,55.4,ST,Yes,Pacific Northwest,True,True
12444290,"ANTOINE CREEK AT US HWY 97 NEAR ELLISFORDE, WA",48.7592699,-119.4092122,WA,047,17020006,17,1702,73.4,ST,Yes,Pacific Northwest,True,True
12444490,"BONAPARTE CREEK NEAR WAUCONDA, WA",48.65710215,-119.2017131,WA,047,17020006,17,1702,96.6,ST,Yes,Pacific Northwest,True,True
12444550,"BONAPARTE CREEK AT TONASKET, WA",48.70121386,-119.442823,WA,047,17020006,17,1702,161.0,ST,Yes,Pacific Northwest,True,True
12445000,"OKANOGAN RIVER NEAR TONASKET, WA",48.632375,-119.4617229,WA,047,17020006,17,1702,7260.0,ST,Yes,Pacific Northwest,True,True
12445500,"JOHNSON CREEK NEAR RIVERSIDE, WA",48.4970458,-119.5261544,WA,047,17020006,17,1702,68.2,ST,Yes,Pacific Northwest,True,True
12445900,"OMAK CREEK NEAR OMAK, WA",48.36704638,-119.4450378,WA,047,17020006,17,1702,119.0,ST,Yes,Pacific Northwest,True,True
12445939,"NO NAME CREEK NEAR SOURCE NEAR OMAK, WA",48.35320796,-119.4436574,WA,047,17020006,17,1702,,ST,Yes,Pacific Northwest,True,True
12445940,"NO NAME CREEK DIVERSION NEAR OMAK, WA",48.3451524,-119.436157,WA,047,17020006,17,1702,,ST,Yes,Pacific Northwest,True,True
12445941,"NO NAME CREEK BELOW DIVERSION NEAR OMAK, WA",48.3451523,-119.4425461,WA,047,17020006,17,1702,,ST,Yes,Pacific Northwest,True,True
12445942,"NO NAME CREEK DIVERSION RETURN NEAR OMAK, WA",48.3401523,-119.4411571,WA,047,17020006,17,1702,,ST,Yes,Pacific Northwest,True,True
12445944,"NO NAME CREEK AT GRANITE LIP NEAR OMAK, WA",48.3293189,-119.4361568,WA,047,17020006,17,1702,,ST,Yes,Pacific Northwest,True,True
12446000,"OKANOGAN RIVER AT OKANOGAN, WA",48.36098426,-119.58172,WA,047,17020006,17,1702,7900.0,ST,Yes,Pacific Northwest,True,True
12446150,"NORTH FORK SALMON CREEK NEAR CONCONULLY, WA",48.59621025,-119.7739423,WA,047,17020006,17,1702,36.7,ST,Yes,Pacific Northwest,True,True
12446400,"WEST FORK SALMON CREEK NEAR CONCONULLY, WA",48.5409324,-119.7642185,WA,047,17020006,17,1702,64.6,ST,Yes,Pacific Northwest,True,True
12446500,"SALMON CREEK NEAR CONCONULLY, WA",48.53320438,-119.7483995,WA,047,17020006,17,1702,121.0,ST,Yes,Pacific Northwest,True,True
12446995,"SALMON CREEK ABOVE DIVERSION NEAR OKANOGAN, WA",48.40515066,-119.6217229,WA,047,17020006,17,1702,148.0,ST,Yes,Pacific Northwest,True,True
12447000,"SALMON CREEK NEAR OKANOGAN, WA",48.3998729,-119.6178337,WA,047,17020006,17,1702,150.0,ST,Yes,Pacific Northwest,True,True
12447200,"OKANOGAN RIVER AT MALOTT, WA",48.2812606,-119.7045047,WA,047,17020006,17,1702,8080.0,ST,Yes,Pacific Northwest,True,True
12447285,"LOUP LOUP CREEK AT MALOTT, WA",48.28315469,-119.7083776,WA,047,17020006,17,1702,64.8,ST,Yes,Pacific Northwest,True,True
12447300,"OKANOGAN RIVER NEAR MALOTT, WA",48.23792679,-119.7325614,WA,047,17020006,17,1702,8220.0,ST,Yes,Pacific Northwest,True,True
12447370,"LOST RIVER NEAR MAZAMA, WA",48.65513985,-120.5062119,WA,047,17020008,17,1702,146.0,ST,Yes,Pacific Northwest,True,True
12447382,"EARLY WINTERS CREEK NEAR MAZAMA, WA",48.5984748,-120.4431528,WA,047,17020008,17,1702,80.2,ST,Yes,Pacific Northwest,True,True
12447383,"METHOW RIVER ABOVE GOAT CREEK NEAR MAZAMA, WA",48.57425,-120.385861,WA,047,17020008,17,1702,373.0,ST,Yes,Pacific Northwest,True,True
12447387,"WOLF CREEK BELOW DIVERSION NEAR WINTHROP, WA",48.4832,-120.3078672,WA,047,17020008,17,1702,32.5,ST,Yes,Pacific Northwest,True,True
12447390,"ANDREWS CREEK NEAR MAZAMA, WA",48.8228737,-120.1459038,WA,047,17020008,17,1702,22.1,ST,Yes,Pacific Northwest,True,True
12447600,"CHEWUCH RIVER ABOVE CUB CREEK NEAR WINTHROP, WA",48.5645898,-120.177586,WA,047,17020008,17,1702,466.0,ST,Yes,Pacific Northwest,True,True
12448000,"CHEWUCH RIVER AT WINTHROP, WA",48.4770898,-120.1864734,WA,047,17020008,17,1702,525.0,ST,Yes,Pacific Northwest,True,True
12448500,"METHOW RIVER AT WINTHROP, WA",48.4734787,-120.1773063,WA,047,17020008,17,1702,1007.0,ST,Yes,Pacific Northwest,True,True
12448620,"METHOW RIVER MVID EAST DIVERSION NEAR WINTHROP, WA",48.41875628,-120.1411932,WA,047,17020008,17,1702,,ST,Yes,Pacific Northwest,True,True
12448990,"TWISP RIVER ABOVE NEWBY CREEK NEAR TWISP, WA",48.38069986,-120.2617534,WA,047,17020008,17,1702,207.0,ST,Yes,Pacific Northwest,True,True
12448992,"TWISP RIVER TVPI DIVERSION NEAR TWISP, WA",48.38042227,-120.2431415,WA,047,17020008,17,1702,,ST,Yes,Pacific Northwest,True,True
12448996,"TWISP RIVER MVID WEST DIVERSION NEAR TWISP, WA",48.36986689,-120.1931393,WA,047,17020008,17,1702,,ST,Yes,Pacific Northwest,True,True
12448998,"TWISP RIVER NEAR TWISP, WA",48.3698671,-120.148693,WA,047,17020008,17,1702,245.0,ST,Yes,Pacific Northwest,True,True
12449500,"METHOW RIVER AT TWISP, WA",48.36514507,-120.1161917,WA,047,17020008,17,1702,1301.0,ST,Yes,Pacific Northwest,True,True
12449510,"METHOW RIVER NEAR TWISP, WA",48.3479228,-120.1070244,WA,047,17020008,17,1702,,ST,Yes,Pacific Northwest,True,True
12449600,"BEAVER CREEK BELOW SOUTH FORK NEAR TWISP, WA",48.4332011,-120.0250776,WA,047,17020008,17,1702,62.0,ST,Yes,Pacific Northwest,True,True
12449700,"BEAVER CREEK NEAR TWISP, WA",48.39708996,-120.0400778,WA,047,17020008,17,1702,68.1,ST,Yes,Pacific Northwest,True,True
12449710,"BEAVER CREEK NEAR MOUTH NEAR TWISP, WA",48.32847868,-120.0592445,WA,047,17020008,17,1702,110.0,ST,Yes,Pacific Northwest,True,True
12449760,"METHOW RIVER AT CARLTON, WA",48.2362554,-120.1131347,WA,047,17020008,17,1702,1531.0,ST,Yes,Pacific Northwest,True,True
12449950,"METHOW RIVER NEAR PATEROS, WA",48.0773639,-119.9850723,WA,047,17020008,17,1702,1772.0,ST,Yes,Pacific Northwest,True,True
12449954,"METHOW RIVER AT 2ND BRIDGE NEAR PATEROS, WA",48.0745865,-119.9567373,WA,047,17020008,17,1702,1777.0,ST,Yes,Pacific Northwest,True,True
12450500,"METHOW RIVER AT PATEROS, WA",48.04708647,-119.91229,WA,047,17020008,17,1702,1810.0,ST,Yes,Pacific Northwest,True,True
12450700,"COLUMBIA RIVER BELOW WELLS DAM, WA",47.94652975,-119.86673,WA,007,17020005,17,1702,86100.0,ST,Yes,Pacific Northwest,True,True
12451000,"STEHEKIN RIVER AT STEHEKIN, WA",48.32958017,-120.6917668,WA,007,17020009,17,1702,321.0,ST,Yes,Pacific Northwest,True,True
12451500,"RAILROAD CREEK AT LUCERNE, WA",48.19569165,-120.5984299,WA,007,17020009,17,1702,64.8,ST,Yes,Pacific Northwest,True,True
12451600,"SAFETY HARBOR CREEK NEAR MANSON, WA",48.1104156,-120.3600888,WA,007,17020009,17,1702,7.85,ST,Yes,Pacific Northwest,True,True
12451620,"GRADE CREEK NEAR MANSON, WA",48.05985999,-120.2584176,WA,007,17020009,17,1702,8.45,ST,Yes,Pacific Northwest,True,True
12451650,"GOLD CREEK NEAR MANSON, WA",48.0243043,-120.19147,WA,007,17020009,17,1702,6.3,ST,Yes,Pacific Northwest,True,True
12451700,"ANTILON LAKE FEEDER SYSTEM NEAR MANSON, WA",47.97902578,-120.164524,WA,007,17020009,17,1702,,ST,Yes,Pacific Northwest,True,True
12452500,"CHELAN RIVER AT CHELAN, WA",47.83528716,-120.009638,WA,007,17020009,17,1702,924.0,ST,Yes,Pacific Northwest,True,True
12452550,"CHELAN R AT HABITAT 4 CHANNEL AT CHELAN FALLS, WA",47.80793056,-119.9857639,WA,007,17020009,17,1702,,ST,Yes,Pacific Northwest,True,True
12452800,"ENTIAT RIVER NEAR ARDENVOIR, WA",47.81846178,-120.4231438,WA,007,17020010,17,1702,203.0,ST,Yes,Pacific Northwest,True,True
12452890,"MAD RIVER AT ARDENVOIR, WA",47.7367943,-120.3686962,WA,007,17020010,17,1702,92.4,ST,Yes,Pacific Northwest,True,True
12452990,"ENTIAT RIVER NEAR ENTIAT, WA",47.663185,-120.250634,WA,007,17020010,17,1702,419.0,ST,Yes,Pacific Northwest,True,True
12453000,"ENTIAT RIVER AT ENTIAT, WA",47.6609631,-120.2261882,WA,007,17020010,17,1702,419.0,ST,Yes,Pacific Northwest,True,True
12453500,"PINE CANYON CREEK NEAR WATERVILLE, WA",47.6692982,-120.112293,WA,017,17020010,17,1702,11.1,ST,Yes,Pacific Northwest,True,True
12453700,"COLUMBIA RIVER AT ROCKY REACH DAM, WA",47.5242934,-120.3022969,WA,007,17020010,17,1702,87800.0,ST,Yes,Pacific Northwest,True,True
12454000,"WHITE RIVER NEAR PLAIN, WA",47.874008,-120.8703752,WA,007,17020011,17,1702,150.0,ST,Yes,Pacific Northwest,True,True
12455000,"WENATCHEE RIVER BELOW WENATCHEE LAKE, WA",47.80817738,-120.7234278,WA,007,17020011,17,1702,273.0,ST,Yes,Pacific Northwest,True,True
12456000,"PHELPS CREEK NEAR PLAIN, WA",48.0734583,-120.8498215,WA,007,17020011,17,1702,16.4,ST,Yes,Pacific Northwest,True,True
12456500,"CHIWAWA RIVER NEAR PLAIN, WA",47.8373111,-120.6622862,WA,007,17020011,17,1702,170.0,ST,Yes,Pacific Northwest,True,True
12457000,"WENATCHEE RIVER AT PLAIN, WA",47.76286656,-120.6661735,WA,007,17020011,17,1702,591.0,ST,Yes,Pacific Northwest,True,True
12457800,"WENATCHEE RIVER NEAR LEAVENWORTH, WA",47.6759549,-120.6567567,WA,007,17020011,17,1702,672.0,ST,Yes,Pacific Northwest,True,True
12458000,"ICICLE CREEK ABOVE SNOW CREEK NEAR LEAVENWORTH, WA",47.54092147,-120.720059,WA,007,17020011,17,1702,193.0,ST,Yes,Pacific Northwest,True,True
12458500,"ICICLE CREEK NEAR LEAVENWORTH, WA",47.5581769,-120.6678643,WA,007,17020011,17,1702,211.0,ST,Yes,Pacific Northwest,True,True
12459000,"WENATCHEE RIVER AT PESHASTIN, WA",47.5831447,-120.6195014,WA,007,17020011,17,1702,1000.0,ST,Yes,Pacific Northwest,True,True
12460500,"WENATCHEE VALLEY CANAL AT DRYDEN, WA",47.5442897,-120.55675,WA,007,17020011,17,1702,,ST-CA,Yes,Pacific Northwest,True,True
12461000,"WENATCHEE RIVER AT DRYDEN, WA",47.54428965,-120.5623057,WA,007,17020011,17,1702,1155.0,ST,Yes,Pacific Northwest,True,True
12461400,"MISSION CREEK ABOVE SAND CREEK NEAR CASHMERE, WA",47.4298462,-120.506745,WA,007,17020011,17,1702,39.8,ST,Yes,Pacific Northwest,True,True
12461500,"SAND CREEK NEAR CASHMERE, WA",47.42984618,-120.5081339,WA,007,17020011,17,1702,18.6,ST,Yes,Pacific Northwest,True,True
12462000,"MISSION CREEK AT CASHMERE, WA",47.51651307,-120.4761913,WA,007,17020011,17,1702,81.2,ST,Yes,Pacific Northwest,True,True
12462500,"WENATCHEE RIVER AT MONITOR, WA",47.4992578,-120.4244935,WA,007,17020011,17,1702,1301.0,ST,Yes,Pacific Northwest,True,True
12462600,"COLUMBIA RIVER BELOW ROCK ISLAND DAM, WA",47.33235176,-120.081171,WA,017,17020010,17,1702,89400.0,ST,Yes,Pacific Northwest,True,True
12463000,"DOUGLAS CREEK NEAR ALSTOWN, WA",47.58401985,-120.023396,WA,017,17020012,17,1702,99.9,ST,Yes,Pacific Northwest,True,True
12463500,"DOUGLAS CREEK NEAR PALISADES, WA",47.4665216,-119.876164,WA,017,17020012,17,1702,206.0,ST,Yes,Pacific Northwest,True,True
12464000,"DOUGLAS CREEK AT PALISADES, WA",47.41652026,-119.9344993,WA,017,17020012,17,1702,844.0,ST,Yes,Pacific Northwest,True,True
12464500,"COLUMBIA RIVER AT TRINIDAD, WA",47.22485308,-120.015056,WA,025,17020010,17,1702,90500.0,ST,Yes,Pacific Northwest,True,True
12464606,"SAND HOLLOW CREEK AT S RD SW NEAR VANTAGE, WA",46.9304106,-119.8997709,WA,025,17020010,17,1702,43.0,ST,Yes,Pacific Northwest,True,True
12464770,"CRAB CREEK AT ROCKY FORD ROAD NEAR RITZVILLE, WA",47.30265108,-118.3691441,WA,043,17020013,17,1702,384.0,ST,Yes,Pacific Northwest,True,True
12464780,"CRAB CREEK ABOVE SYLVAN LAKE NEAR LAMONA, WA",47.3087596,-118.4994292,WA,043,17020013,17,1702,542.0,ST,Yes,Pacific Northwest,True,True
12464800,"COAL CREEK AT MOHLER, WA",47.4068192,-118.3188652,WA,043,17020013,17,1702,64.7,ST,Yes,Pacific Northwest,True,True
12464810,"CRAB CREEK BELOW SYLVAN LAKE NEAR ODESSA, WA",47.3215364,-118.6080456,WA,043,17020013,17,1702,,ST,Yes,Pacific Northwest,True,True
12465000,"CRAB CREEK AT IRBY, WA",47.36038447,-118.8499972,WA,043,17020013,17,1702,1042.0,ST,Yes,Pacific Northwest,True,True
12465400,"WILSON CREEK BELOW CORBETT DRAW NEAR ALMIRA, WA",47.6629263,-118.9305666,WA,043,17020013,17,1702,327.0,ST,Yes,Pacific Northwest,True,True
12465500,"WILSON CREEK AT WILSON CREEK, WA",47.430423,-119.1039046,WA,025,17020013,17,1702,427.0,ST,Yes,Pacific Northwest,True,True
12466015,"CRAB CREEK NEAR STRATFORD, WA",47.42803889,-119.2021944,WA,025,17020013,17,1702,,ST,Yes,Pacific Northwest,True,True
12466100,"WEST CANAL NEAR ROYAL CITY, WA",46.93486035,-119.5647553,WA,025,17020015,17,1702,,ST-CA,Yes,Pacific Northwest,True,True
