state_code,nws_id,usgs_id,goes_id,nws_hsa,latitude_dms,longitude_dms,latitude_decimal,longitude_decimal,station_name,raw_line
MT,DRMM8,12331800,DDCDE340,MSO,46 42 42.89,113 19 50.81,46.711913888888894,-113.33078055555555,CLARK FORK NEAR DRUMMOND MT,DRMM8|12331800       |DDCDE340|MSO|46 42 42.89|113 19 50.81|CLARK FORK NEAR DRUMMOND MT
MT,FCFM8,12355500,345CE6FA,MSO,48 29 44.87,114 07 36.35,48.49579722222222,-114.12676388888889,N F FLATHEAD RIVER NR COLUMBIA FALLS MT,FCFM8|12355500       |345CE6FA|MSO|48 29 44.87|114 07 36.35|N F FLATHEAD RIVER NR COLUMBIA FALLS MT
MT,FCKM8,12331500,DDD09128,MSO,46 37 43.42,113 09 02.49,46.628727777777776,-113.15069166666667,FLINT CREEK NEAR DRUMMOND MT,FCKM8|12331500       |DDD09128|MSO|46 37 43.42|113 09 02.49|FLINT CREEK NEAR DRUMMOND MT
MT,FISM8,12302055,DE08A108,MSO,48 21 20.17,115 18 52.74,48.355602777777776,-115.31465,FISHER RIVER NEAR LIBBY MT,FISM8|12302055       |DE08A108|MSO|48 21 20.17|115 18 52.74|FISHER RIVER NEAR LIBBY MT
MT,FLNM8,12329500,DE0AC11A,MSO,46 27 49.53,113 14 25.00,46.46375833333334,-113.24027777777778,FLINT CREEK AT MAXVILLE MT,FLNM8|12329500       |DE0AC11A|MSO|46 27 49.53|113 14 25.00|FLINT CREEK AT MAXVILLE MT
MT,FOYM8,12366500,165F657E,MSO,48 09 15.52,114 14 56.13,48.15431111111111,-114.248925,FLATHEAD RIVER AT FOYS BEND NR KALISPELL MT,FOYM8|12366500       |165F657E|MSO|48 09 15.52|114 14 56.13|FLATHEAD RIVER AT FOYS BEND NR KALISPELL MT
MT,FPOM8,12372000,F0034686,MSO,47 40 49.03,114 14 48.22,47.68028611111111,-114.24672777777778,FLATHEAD RIVER NEAR POLSON MT,FPOM8|12372000       |F0034686|MSO|47 40 49.03|114 14 48.22|FLATHEAD RIVER NEAR POLSON MT
MT,FTCM8,12325500,DE0AB78A,MSO,46 13 57.60,113 17 59.54,46.23266666666667,-113.29987222222222,FLINT CREEK NEAR SOUTHERN CROSS MT,FTCM8|12325500       |DE0AB78A|MSO|46 13 57.60|113 17 59.54|FLINT CREEK NEAR SOUTHERN CROSS MT
MT,GALM8,12323800,DDD5666C,MSO,46 12 29.67,112 46 02.46,46.208241666666666,-112.76735,CLARK FORK NEAR GALEN MT,GALM8|12323800       |DDD5666C|MSO|46 12 29.67|112 46 02.46|CLARK FORK NEAR GALEN MT
MT,HGHM8,482100114000001,347C7276,MSO,48 20 28,114 00 48,48.34111111111111,-114.01333333333334,HUNGRY HORSE DAM MT (USBR PRECIP SITE),HGHM8|482100114000001|347C7276|MSO|48 20 28   |114 00 48   |HUNGRY HORSE DAM MT (USBR PRECIP SITE)
MT,HHWM8,12362000,345EB372,MSO,48 20 28,114 00 48,48.34111111111111,-114.01333333333334,HUNGRY HORSE RESERVOIR NR HUNGRY HORSE MT,HHWM8|12362000       |345EB372|MSO|48 20 28   |114 00 48   |HUNGRY HORSE RESERVOIR NR HUNGRY HORSE MT
MT,KBDM8,12301933,CE11B438,MSO,48 24 02.39,115 19 07.39,48.400663888888886,-115.31871944444444,KOOTENAI RIVER BL LIBBY DAM NR LIBBY MT,KBDM8|12301933       |CE11B438|MSO|48 24 02.39|115 19 07.39|KOOTENAI RIVER BL LIBBY DAM NR LIBBY MT
MT,KERM8,12371550,DF05403E,MSO,47 41 48.87,114 09 40.67,47.69690833333333,-114.16129722222223,FLATHEAD LAKE AT POLSON MT,KERM8|12371550       |DF05403E|MSO|47 41 48.87|114 09 40.67|FLATHEAD LAKE AT POLSON MT
MT,LBFM8,12324590,163F52D6,MSO,46 31 10.14,112 47 35.42,46.51948333333333,-112.79317222222222,LITTLE BLACKFOOT RIVER NEAR GARRISON MT,LBFM8|12324590       |163F52D6|MSO|46 31 10.14|112 47 35.42|LITTLE BLACKFOOT RIVER NEAR GARRISON MT
MT,LCGM8,12323850,DD60C09C,MSO,46 13 06.86,112 46 27.00,46.21857222222222,-112.77416666666666,LOST CREEK NEAR GALEN MT,LCGM8|12323850       |DD60C09C|MSO|46 13 06.86|112 46 27.00|LOST CREEK NEAR GALEN MT
MT,LOLM8,464329114315900,1638C580,MSO,46 43 29,114 31 59,46.724722222222226,-114.53305555555555,LOLO HOT SPRINGS P. NR LOLO MT,LOLM8|464329114315900|1638C580|MSO|46 43 29   |114 31 59   |LOLO HOT SPRINGS P. NR LOLO MT
MT,MCAM8,12323670,DD7893D8,MSO,46 04 58.70,112 55 01.88,46.082972222222224,-112.91718888888889,MILL CREEK NR ANACONDA MT,MCAM8|12323670       |DD7893D8|MSO|46 04 58.70|112 55 01.88|MILL CREEK NR ANACONDA MT
MT,MFRM8,12332000,DD342216,MSO,46 11 04.45,113 30 05.65,46.18456944444444,-113.50156944444444,MIDDLE FORK ROCK CR NR PHILIPSBURG MT,MFRM8|12332000       |DD342216|MSO|46 11 04.45|113 30 05.65|MIDDLE FORK ROCK CR NR PHILIPSBURG MT
MT,MSNM8,12377150,DE3A8460,MSO,47 19 12.69,113 59 16.41,47.32019166666667,-113.98789166666667,MISSION CREEK AB RESERVOIR NR ST. IGNATIUS MT,MSNM8|12377150       |DE3A8460|MSO|47 19 12.69|113 59 16.41|MISSION CREEK AB RESERVOIR NR ST. IGNATIUS MT
MT,OPPM8,12323600,DD6F536C,MSO,46 06 27.93,112 48 19.02,46.10775833333334,-112.80528333333334,SILVER BOW CREEK AT OPPORTUNITY MT,OPPM8|12323600       |DD6F536C|MSO|46 06 27.93|112 48 19.02|SILVER BOW CREEK AT OPPORTUNITY MT
MT,OVNM8,470109113074400,1638EDBE,MSO,47 01 09,113 07 44,47.01916666666666,-113.12888888888888,OVANDO P. NR OVANDO MT,OVNM8|470109113074400|1638EDBE|MSO|47 01 09   |113 07 44   |OVANDO P. NR OVANDO MT
MT,PERM8,12388700,DDD5751A,MSO,47 22 00.45,114 35 06.00,47.366791666666664,-114.585,FLATHEAD RIVER AT PERMA MT,PERM8|12388700       |DDD5751A|MSO|47 22 00.45|114 35 06.00|FLATHEAD RIVER AT PERMA MT
MT,PLNM8,12389000,DDF93662,MSO,47 25 45.12,114 51 23.52,47.429199999999994,-114.85653333333333,CLARK FORK NEAR PLAINS MT,PLNM8|12389000       |DDF93662|MSO|47 25 45.12|114 51 23.52|CLARK FORK NEAR PLAINS MT
MT,PLVM8,480634114520700,163828A0,MSO,48 06 34,114 52 07,48.10944444444445,-114.86861111111111,PLEASANT VALLEY P. NR PLEASANT VALLEY MT,PLVM8|480634114520700|163828A0|MSO|48 06 34   |114 52 07   |PLEASANT VALLEY P. NR PLEASANT VALLEY MT
MT,POLM8,484554114170100,1638E36C,MSO,48 45 54,114 17 01,48.765,-114.28361111111111,POLEBRIDGE P. NR POLEBRIDGE MT,POLM8|484554114170100|1638E36C|MSO|48 45 54   |114 17 01   |POLEBRIDGE P. NR POLEBRIDGE MT
MT,PRCM8,12390700,DE39A582,MSO,47 35 09.82,115 21 18.36,47.586061111111114,-115.3551,PROSPECT CREEK AT THOMPSON FALLS MT,PRCM8|12390700       |DE39A582|MSO|47 35 09.82|115 21 18.36|PROSPECT CREEK AT THOMPSON FALLS MT
MT,RCCM8,12334510,DE089492,MSO,46 43 20.41,113 40 59.02,46.72233611111111,-113.68306111111112,ROCK CREEK NEAR CLINTON MT,RCCM8|12334510       |DE089492|MSO|46 43 20.41|113 40 59.02|ROCK CREEK NEAR CLINTON MT
MT,SELM8,471300113310001,34422012,MSO,47 12 45,113 31 09,47.212500000000006,-113.51916666666666,SEELEY LAKE MT (USBR PRECIP SITE),SELM8|471300113310001|34422012|MSO|47 12 45   |113 31 09   |SEELEY LAKE MT (USBR PRECIP SITE)
MT,SFCM8,12362500,3461860A,MSO,48 21 23.68,114 02 16.29,48.35657777777778,-114.03785833333333,S F FLATHEAD RIVER NR COLUMBIA FALLS MT,SFCM8|12362500       |3461860A|MSO|48 21 23.68|114 02 16.29|S F FLATHEAD RIVER NR COLUMBIA FALLS MT
MT,SLVM8,12323250,DDE5601C,MSO,45 59 57,112 34 38.36,45.99916666666667,-112.57732222222222,SILVER BOW CR BL BLACKTAIL CR AT BUTTE MT,SLVM8|12323250       |DDE5601C|MSO|45 59 57   |112 34 38.36|SILVER BOW CR BL BLACKTAIL CR AT BUTTE MT
MT,SRGM8,12354500,DE08E202,MSO,47 18 05.90,115 05 12.73,47.30163888888889,-115.08686944444445,CLARK FORK AT ST. REGIS MT,SRGM8|12354500       |DE08E202|MSO|47 18 05.90|115 05 12.73|CLARK FORK AT ST. REGIS MT
MT,SRLM8,12365700,DE08B27E,MSO,48 13 02.10,114 18 49.45,48.21725,-114.31373611111111,STILLWATER RIVER AT LAWRENCE PARK AT KALISPELL,SRLM8|12365700       |DE08B27E|MSO|48 13 02.10|114 18 49.45|STILLWATER RIVER AT LAWRENCE PARK AT KALISPELL
MT,SUMM8,481900113210001,34425682,MSO,48 19 00,113 21 00,48.31666666666667,-113.35,MARIAS SUMMIT MT (USBR PRECIP SITE),SUMM8|481900113210001|34425682|MSO|48 19 00   |113 21 00   |MARIAS SUMMIT MT (USBR PRECIP SITE)
MT,SWLM8,475500113500001,34426318,MSO,47 55 47,113 50 42,47.92972222222222,-113.845,SWAN LAKE MT (USBR PRECIP SITES),SWLM8|475500113500001|34426318|MSO|47 55 47   |113 50 42   |SWAN LAKE MT (USBR PRECIP SITES)
MT,SWRM8,12370000,DE348008,MSO,48 01 27.23,113 58 43.75,48.024230555555555,-113.97881944444444,SWAN RIVER NEAR BIGFORK MT,SWRM8|12370000       |DE348008|MSO|48 01 27.23|113 58 43.75|SWAN RIVER NEAR BIGFORK MT
MT,TBAM8,12301250,16E912E8,MSO,48 52 40.61,115 03 16.06,48.877947222222225,-115.05446111111111,TOBACCO RIVER AT EUREKA MT,TBAM8|12301250       |16E912E8|MSO|48 52 40.61|115 03 16.06|TOBACCO RIVER AT EUREKA MT
MT,THRM8,12389500,DDF940F2,MSO,47 35 30.69,115 13 46.33,47.591858333333334,-115.22953611111112,THOMPSON RIVER NEAR THOMPSON FALLS MT,THRM8|12389500       |DDF940F2|MSO|47 35 30.69|115 13 46.33|THOMPSON RIVER NEAR THOMPSON FALLS MT
MT,TNCM8,12359800,345D211E,MSO,47 58 44.75,113 33 38.46,47.97909722222222,-113.56068333333333,S F FLATHEAD R AB TWIN C NR HUNGRY HORSE MT,TNCM8|12359800       |345D211E|MSO|47 58 44.75|113 33 38.46|S F FLATHEAD R AB TWIN C NR HUNGRY HORSE MT
MT,TRYM8,12304500,DE06A560,MSO,48 33 42.20,115 58 12.57,48.56172222222222,-115.97015833333333,YAAK RIVER NEAR TROY MT,TRYM8|12304500       |DE06A560|MSO|48 33 42.20|115 58 12.57|YAAK RIVER NEAR TROY MT
MT,VICM8,12350250,D10F171E,MSO,46 26 35.52,114 07 25.56,46.4432,-114.12376666666665,BITTERROOT RIVER AT BELL CROSSING NR VICTOR MT,VICM8|12350250       |D10F171E|MSO|46 26 35.52|114 07 25.56|BITTERROOT RIVER AT BELL CROSSING NR VICTOR MT
MT,WCAM8,12323710,DD78A642,MSO,46 03 52.24,112 53 36.71,46.06451111111111,-112.89353055555556,WILLOW CREEK NR ANACONDA MT,WCAM8|12323710       |DD78A642|MSO|46 03 52.24|112 53 36.71|WILLOW CREEK NR ANACONDA MT
MT,WFBM8,12342500,DE3AA28C,MSO,45 43 29.38,114 16 56.26,45.72482777777778,-114.28229444444445,WEST FORK BITTERROOT RIVER NR CONNER MT,WFBM8|12342500       |DE3AA28C|MSO|45 43 29.38|114 16 56.26|WEST FORK BITTERROOT RIVER NR CONNER MT
MT,WGCM8,12358500,345D81E6,MSO,48 29 43.86,114 00 36.75,48.49551666666667,-114.01020833333334,M F FLATHEAD RIVER NEAR WEST GLACIER MT,WGCM8|12358500       |345D81E6|MSO|48 29 43.86|114 00 36.75|M F FLATHEAD RIVER NEAR WEST GLACIER MT
MT,WGLM8,483000113540001,3442EBDE,MSO,48 30 02.15,113 59 04.80,48.500597222222225,-113.98466666666667,WEST GLACIER PRECIP STATION AT WEST GLACIER MT,WGLM8|483000113540001|3442EBDE|MSO|48 30 02.15|113 59 04.80|WEST GLACIER PRECIP STATION AT WEST GLACIER MT
MT,WHRM8,12366000,DE08C4EE,MSO,48 19 12.67,114 16 42.94,48.32018611111111,-114.27859444444444,WHITEFISH RIVER NEAR KALISPELL MT,WHRM8|12366000       |DE08C4EE|MSO|48 19 12.67|114 16 42.94|WHITEFISH RIVER NEAR KALISPELL MT
MT,WMSM8,12323750,DDD072DA,MSO,46 10 46.19,112 46 50.02,46.17949722222222,-112.78056111111111,SILVER BOW CREEK AT WARM SPRINGS MT,WMSM8|12323750       |DDD072DA|MSO|46 10 46.19|112 46 50.02|SILVER BOW CREEK AT WARM SPRINGS MT
MT,WSPM8,12323770,DE063002,MSO,46 10 49.35,112 47 06.28,46.180375,-112.78507777777777,WARM SPRINGS CREEK AT WARM SPRINGS MT,WSPM8|12323770       |DE063002|MSO|46 10 49.35|112 47 06.28|WARM SPRINGS CREEK AT WARM SPRINGS MT
MT,GDRM8,06191000,D10F0468,RIW,44 59 32.44,110 41 27.51,44.99234444444445,-110.69097500000001,GARDNER RIVER NEAR MAMMOTH YNP,GDRM8|06191000       |D10F0468|RIW|44 59 32.44|110 41 27.51|GARDNER RIVER NEAR MAMMOTH YNP
MT,SBCM8,06187915,DD9C63EC,RIW,45 00 10.19,110 00 06.74,45.002830555555555,-110.00187222222222,SODA BUTTE CR AT PARK BNDRY AT SILVER GATE,SBCM8|06187915       |DD9C63EC|RIW|45 00 10.19|110 00 06.74|SODA BUTTE CR AT PARK BNDRY AT SILVER GATE
MT,ADDM8,06080900,163AFB3C,TFX,47 37 06.62,112 41 31.40,47.61850555555556,-112.69205555555556,SUN RIVER BL DIVERSION DAM NR AUGUSTA MT,ADDM8|06080900       |163AFB3C|TFX|47 37 06.62|112 41 31.40|SUN RIVER BL DIVERSION DAM NR AUGUSTA MT
MT,BARM8,06016000,163F41A0,TFX,45 06 58.06,112 45 01.78,45.11612777777778,-112.75049444444444,BEAVERHEAD RIVER AT BARRETTS MT,BARM8|06016000       |163F41A0|TFX|45 06 58.06|112 45 01.78|BEAVERHEAD RIVER AT BARRETTS MT
MT,BCMM8,06151500,162C3972,TFX,48 38 58.17,109 13 54.10,48.64949166666667,-109.23169444444444,BATTLE CREEK NEAR CHINOOK MT,BCMM8|06151500       |162C3972|TFX|48 38 58.17|109 13 54.10|BATTLE CREEK NEAR CHINOOK MT
MT,BDCM8,06093200,3462A7E8,TFX,48 22 10.02,112 48 06.41,48.36945,-112.80178055555555,BADGER CR BL FOUR HORNS CANAL NR BROWNING MT,BDCM8|06093200       |3462A7E8|TFX|48 22 10.02|112 48 06.41|BADGER CR BL FOUR HORNS CANAL NR BROWNING MT
MT,BGKM8,06024450,DE08F174,TFX,45 37 04.68,113 27 24.99,45.61796666666667,-113.45694166666667,BIG HOLE RIVER BL BIG LAKE CR AT WISDOM MT,BGKM8|06024450       |DE08F174|TFX|45 37 04.68|113 27 24.99|BIG HOLE RIVER BL BIG LAKE CR AT WISDOM MT
MT,BHDM8,06024540,DD9662BE,TFX,45 48 27.15,113 18 47.77,45.807541666666665,-113.31326944444444,BIG HOLE RIVER BL MUDD CR NR WISDOM MT,BHDM8|06024540       |DD9662BE|TFX|45 48 27.15|113 18 47.77|BIG HOLE RIVER BL MUDD CR NR WISDOM MT
MT,BLDM8,06033000,1718D6BA,TFX,46 12 39.71,112 05 29.94,46.21103055555556,-112.09165,BOULDER RIVER NEAR BOULDER MT,BLDM8|06033000       |1718D6BA|TFX|46 12 39.71|112 05 29.94|BOULDER RIVER NEAR BOULDER MT
MT,BSMM8,06139500,DF05F3B0,TFX,48 31 36.17,109 50 29.68,48.526713888888885,-109.84157777777777,BIG SANDY CREEK NEAR HAVRE MT,BSMM8|06139500       |DF05F3B0|TFX|48 31 36.17|109 50 29.68|BIG SANDY CREEK NEAR HAVRE MT
MT,BTCM8,06090500,DF0487DA,TFX,47 12 30.94,110 55 54.29,47.20859444444445,-110.93174722222223,BELT CREEK NEAR MONARCH MT,BTCM8|06090500       |DF0487DA|TFX|47 12 30.94|110 55 54.29|BELT CREEK NEAR MONARCH MT
MT,CBKM8,06099000,16E8E096,TFX,48 38 00.25,112 20 47.33,48.633402777777775,-112.34648055555554,CUT BANK CREEK AT CUT BANK MT,CBKM8|06099000       |16E8E096|TFX|48 38 00.25|112 20 47.33|CUT BANK CREEK AT CUT BANK MT
MT,CCMM8,06142400,162C5C94,TFX,48 34 43.93,109 23 28.07,48.57886944444445,-109.39113055555556,CLEAR CREEK NEAR CHINOOK MT,CCMM8|06142400       |162C5C94|TFX|48 34 43.93|109 23 28.07|CLEAR CREEK NEAR CHINOOK MT
MT,CMNM8,06040000,163F39E2,TFX,45 13 59.28,111 45 05.88,45.233133333333335,-111.75163333333333,MADISON RIVER NEAR CAMERON MT,CMNM8|06040000       |163F39E2|TFX|45 13 59.28|111 45 05.88|MADISON RIVER NEAR CAMERON MT
MT,CMRM8,06038800,D10F2284,TFX,44 53 19.16,111 34 51.19,44.88865555555555,-111.58088611111111,MADISON RIVER AT KIRBY RANCH NR CAMERON MT,CMRM8|06038800       |D10F2284|TFX|44 53 19.16|111 34 51.19|MADISON RIVER AT KIRBY RANCH NR CAMERON MT
MT,CRKM8,06146980,1739E034,TFX,48 40 31.3,109 16 30,48.67536111111111,-109.275,LODGE CREEK NEAR CHINOOK MT,CRKM8|06146980       |1739E034|TFX|48 40 31.3 |109 16 30   |LODGE CREEK NEAR CHINOOK MT
MT,DBRM8,06073500,DD1F702C,TFX,47 11 56.49,112 05 45.26,47.199025,-112.09590555555555,DEARBORN RIVER NEAR CRAIG MT,DBRM8|06073500       |DD1F702C|TFX|47 11 56.49|112 05 45.26|DEARBORN RIVER NEAR CRAIG MT
MT,DILM8,06017000,DD3094A2,TFX,45 13 06.18,112 39 19.20,45.218383333333335,-112.65533333333335,BEAVERHEAD RIVER AT DILLON MT,DILM8|06017000       |DD3094A2|TFX|45 13 06.18|112 39 19.20|BEAVERHEAD RIVER AT DILLON MT
MT,ECCM8,485831110252101,DE0AE7F6,TFX,48 58 30.75,110 25 21.29,48.975208333333335,-110.42258055555556,MET STATION AT MILK R EASTERN CROSSING INTL BNDRY,ECCM8|485831110252101|DE0AE7F6|TFX|48 58 30.75|110 25 21.29|MET STATION AT MILK R EASTERN CROSSING INTL BNDRY
MT,EDNM8,06077500,DE0690FA,TFX,47 11 21.45,111 23 10.46,47.18929166666666,-111.3862388888889,SMITH RIVER NEAR EDEN MT,EDNM8|06077500       |DE0690FA|TFX|47 11 21.45|111 23 10.46|SMITH RIVER NEAR EDEN MT
MT,EGBM8,06048650,DD7F6168,TFX,45 43 32.4,111 03 58.3,45.72566666666667,-111.06619444444445,E GALLATIN R AB WATER RECLAMATION FA NR BOZEMAN MT,EGBM8|06048650       |DD7F6168|TFX|45 43 32.4 |111 03 58.3 |E GALLATIN R AB WATER RECLAMATION FA NR BOZEMAN MT
MT,ERNM8,06135000,34633070,TFX,48 58 29.35,110 25 18.40,48.97481944444445,-110.42177777777778,MILK RIVER AT EASTERN CROSSING OF INT BNDRY,ERNM8|06135000       |34633070|TFX|48 58 29.35|110 25 18.40|MILK RIVER AT EASTERN CROSSING OF INT BNDRY
MT,FBNM8,06090800,DD7F721E,TFX,47 49 00.88,110 39 58.11,47.81691111111112,-110.66614166666668,MISSOURI RIVER AT FORT BENTON MT,FBNM8|06090800       |DD7F721E|TFX|47 49 00.88|110 39 58.11|MISSOURI RIVER AT FORT BENTON MT
MT,GDMM8,473603112451801,344142FA,TFX,47 36 03.90,112 45 16.86,47.601083333333335,-112.75468333333333,NEAR GIBSON DAM NEAR AUGUSTA MT,GDMM8|473603112451801|344142FA|TFX|47 36 03.90|112 45 16.86|NEAR GIBSON DAM NEAR AUGUSTA MT
MT,GFLM8,06090300,D10EF616,TFX,47 35 04.00,111 03 38.09,47.58444444444444,-111.06058055555555,MISSOURI RIVER NEAR GREAT FALLS MT,GFLM8|06090300       |D10EF616|TFX|47 35 04.00|111 03 38.09|MISSOURI RIVER NEAR GREAT FALLS MT
MT,GLGM8,06043500,DE345660,TFX,45 29 50.28,111 16 14.55,45.4973,-111.27070833333333,GALLATIN RIVER NEAR GALLATIN GATEWAY MT,GLGM8|06043500       |DE345660|TFX|45 29 50.28|111 16 14.55|GALLATIN RIVER NEAR GALLATIN GATEWAY MT
MT,GNLM8,06026210,DD9671C8,TFX,45 26 24.34,112 33 21.93,45.44009444444444,-112.55609166666666,BIG HOLE RIVER NEAR GLEN MT,GNLM8|06026210       |DD9671C8|TFX|45 26 24.34|112 33 21.93|BIG HOLE RIVER NEAR GLEN MT
MT,HASM8,06065500,DE34708C,TFX,46 45 58.29,111 53 19.66,46.766191666666664,-111.88879444444446,MISSOURI RIVER BL HAUSER DAM NEAR HELENA MT,HASM8|06065500       |DE34708C|TFX|46 45 58.29|111 53 19.66|MISSOURI RIVER BL HAUSER DAM NEAR HELENA MT
MT,HBDM8,06038500,F0010078,TFX,44 51 59.01,111 20 19.61,44.866391666666665,-111.33878055555554,MADISON RIVER BL HEBGEN LAKE NR GRAYLING MT,HBDM8|06038500       |F0010078|TFX|44 51 59.01|111 20 19.61|MADISON RIVER BL HEBGEN LAKE NR GRAYLING MT
MT,HCCM8,06050000,16E9770E,TFX,45 33 47.98,111 04 18.80,45.56332777777777,-111.07188888888888,HYALITE C AT HYALITE R S NR BOZEMAN MT,HCCM8|06050000       |16E9770E|TFX|45 33 47.98|111 04 18.80|HYALITE C AT HYALITE R S NR BOZEMAN MT
MT,HRLM8,06154100,17235576,TFX,48 29 22.71,108 45 32.22,48.48964166666667,-108.75895,MILK RIVER NEAR HARLEM MT,HRLM8|06154100       |17235576|TFX|48 29 22.71|108 45 32.22|MILK RIVER NEAR HARLEM MT
MT,HTRM8,06066500,DE067308,TFX,46 59 41.06,112 00 38.40,46.99473888888889,-112.01066666666667,MISSOURI RIVER BL HOLTER DAM NR WOLF CR MT,HTRM8|06066500       |DE067308|TFX|46 59 41.06|112 00 38.40|MISSOURI RIVER BL HOLTER DAM NR WOLF CR MT
MT,HVRM8,06140500,1718C5CC,TFX,48 33 49.27,109 41 45.44,48.56368611111111,-109.69595555555556,MILK RIVER AT HAVRE MT,HVRM8|06140500       |1718C5CC|TFX|48 33 49.27|109 41 45.44|MILK RIVER AT HAVRE MT
MT,JDRM8,06114700,162D00C0,TFX,47 39 54.57,109 39 07.25,47.66515833333333,-109.65201388888889,JUDITH RIVER NR MOUTH NR WINIFRED MT,JDRM8|06114700       |162D00C0|TFX|47 39 54.57|109 39 07.25|JUDITH RIVER NR MOUTH NR WINIFRED MT
MT,JRUM8,06110020,16E8F3E0,TFX,46 55 03.8,110 11 20.2,46.91772222222222,-110.18894444444445,JUDITH RIVER ABOVE CARR CREEK NEAR UTICA MT,JRUM8|06110020       |16E8F3E0|TFX|46 55 03.8 |110 11 20.2 |JUDITH RIVER ABOVE CARR CREEK NEAR UTICA MT
MT,LDKM8,06115200,CE5DC0E8,TFX,47 37 53.15,108 41 15.88,47.63143055555555,-108.68774444444445,MISSOURI RIVER NEAR LANDUSKY MT,LDKM8|06115200       |CE5DC0E8|TFX|47 37 53.15|108 41 15.88|MISSOURI RIVER NEAR LANDUSKY MT
MT,LEEM8,06143900,DDE546F0,TFX,48 39 14.26,109 31 49.72,48.65396111111111,-109.53047777777778,REDROCK COULEE NEAR CHINOOK MT,LEEM8|06143900       |DDE546F0|TFX|48 39 14.26|109 31 49.72|REDROCK COULEE NEAR CHINOOK MT
MT,LOGM8,06052500,CE78ADF2,TFX,45 53 10.49,111 26 31.23,45.886247222222224,-111.44200833333333,GALLATIN RIVER AT LOGAN MT,LOGM8|06052500       |CE78ADF2|TFX|45 53 10.49|111 26 31.23|GALLATIN RIVER AT LOGAN MT
MT,LOMM8,06102050,D10414B6,TFX,47 56 45.25,110 34 51.02,47.945902777777775,-110.58083888888889,MARIAS RIVER NEAR LOMA MT,LOMM8|06102050       |D10414B6|TFX|47 56 45.25|110 34 51.02|MARIAS RIVER NEAR LOMA MT
MT,LPPM8,06071300,DE06607E,TFX,47 00 19.57,112 04 13.12,47.00543611111111,-112.07031111111111,LITTLE PRICKLY PEAR CR AT WOLF CR MT,LPPM8|06071300       |DE06607E|TFX|47 00 19.57|112 04 13.12|LITTLE PRICKLY PEAR CR AT WOLF CR MT
MT,LRRM8,06012500,34867130,TFX,44 39 21.17,112 22 16.40,44.655880555555555,-112.37122222222222,RED ROCK R BL LIMA RESERVOIR NR MONIDA MT,LRRM8|06012500       |34867130|TFX|44 39 21.17|112 22 16.40|RED ROCK R BL LIMA RESERVOIR NR MONIDA MT
MT,LTPM8,06111800,16E9019E,TFX,47 05 16.2,109 27 27.0,47.087833333333336,-109.4575,BIG SPRING CR AT R&B TRADING POST NR LEWISTOWN MT,LTPM8|06111800       |16E9019E|TFX|47 05 16.2 |109 27 27.0 |BIG SPRING CR AT R&B TRADING POST NR LEWISTOWN MT
MT,LTRM8,06108800,162C37A0,TFX,47 55 57.79,110 30 51.96,47.932719444444444,-110.51443333333333,TETON RIVER AT LOMA MT,LTRM8|06108800       |162C37A0|TFX|47 55 57.79|110 30 51.96|TETON RIVER AT LOMA MT
MT,MADM8,06137574,D10F72F8,TFX,48 18 17.17,109 55 26.51,48.30476944444444,-109.92403055555556,BOXELDER CR BL BROWN'S RES DIV NR BOX ELDER MT,MADM8|06137574       |D10F72F8|TFX|48 18 17.17|109 55 26.51|BOXELDER CR BL BROWN'S RES DIV NR BOX ELDER MT
MT,MDSM8,06037500,DD7F54F2,TFX,44 39 25.46,111 04 04.67,44.65707222222222,-111.06796388888888,MADISON RIVER NEAR WEST YELLOWSTONE MT,MDSM8|06037500       |DD7F54F2|TFX|44 39 25.46|111 04 04.67|MADISON RIVER NEAR WEST YELLOWSTONE MT
MT,MDYM8,06088500,17C057F2,TFX,47 33 40.56,111 32 30.37,47.56126666666666,-111.54176944444444,MUDDY CREEK AT VAUGHN MT,MDYM8|06088500       |17C057F2|TFX|47 33 40.56|111 32 30.37|MUDDY CREEK AT VAUGHN MT
MT,MGGM8,05014500,DD965724,TFX,48 47 55.80,113 39 24.23,48.798833333333334,-113.65673055555555,SWIFTCURRENT CREEK AT MANY GLACIER MT,MGGM8|05014500       |DD965724|TFX|48 47 55.80|113 39 24.23|SWIFTCURRENT CREEK AT MANY GLACIER MT
MT,MLRM8,06025500,1735112C,TFX,45 31 35.69,112 42 06.21,45.526580555555554,-112.701725,BIG HOLE RIVER NEAR MELROSE MT,MLRM8|06025500       |1735112C|TFX|45 31 35.69|112 42 06.21|BIG HOLE RIVER NEAR MELROSE MT
MT,MRCM8,06101500,3473A28C,TFX,48 18 21.46,111 04 49.90,48.30596111111111,-111.08052777777777,MARIAS RIVER NEAR CHESTER MT,MRCM8|06101500       |3473A28C|TFX|48 18 21.46|111 04 49.90|MARIAS RIVER NEAR CHESTER MT
MT,MRDM8,06025250,DDE52316,TFX,45 42 04.57,112 44 09.49,45.70126944444445,-112.73596944444445,BIG HOLE RIVER AT MAIDEN ROCK NR DIVIDE MT,MRDM8|06025250       |DDE52316|TFX|45 42 04.57|112 44 09.49|BIG HOLE RIVER AT MAIDEN ROCK NR DIVIDE MT
MT,MRPM8,06040800,D10F827C,TFX,45 29 11.74,111 38 01.89,45.48659444444444,-111.63385833333334,MADISON RIVER AB POWERPLANT NR MCALLISTER MT,MRPM8|06040800       |D10F827C|TFX|45 29 11.74|111 38 01.89|MADISON RIVER AB POWERPLANT NR MCALLISTER MT
MT,NFMM8,06133500,34632306,TFX,48 57 48.70,113 03 44.48,48.96352777777778,-113.06235555555556,N F MILK RIVER AB ST. MARY CANAL NR BROWNING MT,NFMM8|06133500       |34632306|TFX|48 57 48.70|113 03 44.48|N F MILK RIVER AB ST. MARY CANAL NR BROWNING MT
MT,NFSM8,06078500,348681B4,TFX,47 38 23.5,112 51 33.6,47.63986111111111,-112.85933333333332,NORTH FORK SUN RIVER NEAR AUGUSTA MT,NFSM8|06078500       |348681B4|TFX|47 38 23.5 |112 51 33.6 |NORTH FORK SUN RIVER NEAR AUGUSTA MT
MT,NMCM8,485748113034401,17AFD546,TFX,48 57 47.79,113 03 44.13,48.963275,-113.06225833333333,MET STATION AT NF MILK R AB ST. MARY CANAL,NMCM8|485748113034401|17AFD546|TFX|48 57 47.79|113 03 44.13|MET STATION AT NF MILK R AB ST. MARY CANAL
MT,NMRM8,06134000,4543C552,TFX,49 01 34.81,112 58 10.91,49.02633611111111,-112.96969722222222,NORTH MILK RIVER NEAR INTERNATIONAL BOUNDARY,NMRM8|06134000       |4543C552|TFX|49 01 34.81|112 58 10.91|NORTH MILK RIVER NEAR INTERNATIONAL BOUNDARY
MT,PBRM8,06027600,163FBFF6,TFX,45 44 51.01,112 11 14.02,45.747502777777775,-112.18722777777778,JEFFERSON RIVER AT PARSONS BDG NR SILVER STAR MT,PBRM8|06027600       |163FBFF6|TFX|45 44 51.01|112 11 14.02|JEFFERSON RIVER AT PARSONS BDG NR SILVER STAR MT
MT,PDBM8,06133000,482F811E,TFX,49 00 27.06,112 32 42.93,49.00751666666667,-112.54525833333334,MILK RIVER AT WESTERN CROSSING OF INT'L BOUNDARY,PDBM8|06133000       |482F811E|TFX|49 00 27.06|112 32 42.93|MILK RIVER AT WESTERN CROSSING OF INT'L BOUNDARY
MT,PEOM8,06154400,DE39836E,TFX,48 13 25.44,108 42 50.59,48.223733333333335,-108.71405277777778,PEOPLES CREEK NEAR HAYS MT,PEOM8|06154400       |DE39836E|TFX|48 13 25.44|108 42 50.59|PEOPLES CREEK NEAR HAYS MT
MT,PKPM8,06061500,16400194,TFX,46 31 08.75,111 56 48.43,46.51909722222222,-111.94678611111111,PRICKLY PEAR CREEK NEAR CLANCY MT,PKPM8|06061500       |16400194|TFX|46 31 08.75|111 56 48.43|PRICKLY PEAR CREEK NEAR CLANCY MT
MT,RIMM8,06062500,DE062374,TFX,46 31 26.03,112 15 23.93,46.523897222222224,-112.25664722222223,TENMILE CREEK NEAR RIMINI MT,RIMM8|06062500       |DE062374|TFX|46 31 26.03|112 15 23.93|TENMILE CREEK NEAR RIMINI MT
MT,RRBM8,06020600,DE064692,TFX,45 14 30.73,112 06 40.46,45.24186944444445,-112.11123888888888,RUBY RIVER BELOW RESERVOIR NEAR ALDER MT,RRBM8|06020600       |DE064692|TFX|45 14 30.73|112 06 40.46|RUBY RIVER BELOW RESERVOIR NEAR ALDER MT
MT,RRLM8,06006000,DD7F4784,TFX,44 36 56.85,111 37 32.41,44.61579166666667,-111.62566944444444,RED ROCK CR AB LAKES NR LAKEVIEW MT,RRLM8|06006000       |DD7F4784|TFX|44 36 56.85|111 37 32.41|RED ROCK CR AB LAKES NR LAKEVIEW MT
MT,RRRM8,06019500,DD9C5676,TFX,45 11 32.35,112 08 34.14,45.19231944444444,-112.14281666666668,RUBY RIVER ABOVE RESERVOIR NEAR ALDER MT,RRRM8|06019500       |DD9C5676|TFX|45 11 32.35|112 08 34.14|RUBY RIVER ABOVE RESERVOIR NEAR ALDER MT
MT,RTBM8,06023000,DE06838C,TFX,45 30 24.89,112 19 51.20,45.50691388888889,-112.33088888888888,RUBY RIVER NEAR TWIN BRIDGES MT,RTBM8|06023000       |DE06838C|TFX|45 30 24.89|112 19 51.20|RUBY RIVER NEAR TWIN BRIDGES MT
MT,SBUM8,05015500,34771438,TFX,48 49 41.14,113 31 19.14,48.828094444444446,-113.52198333333334,LAKE SHERBURNE AT SHERBURNE MT,SBUM8|05015500       |34771438|TFX|48 49 41.14|113 31 19.14|LAKE SHERBURNE AT SHERBURNE MT
MT,SCCM8,05018500,34629272,TFX,48 56 49.08,113 22 31.19,48.94696666666666,-113.37533055555555,ST. MARY CANAL AT ST. MARY CROSSING NEAR BABB MT,SCCM8|05018500       |34629272|TFX|48 56 49.08|113 22 31.19|ST. MARY CANAL AT ST. MARY CROSSING NEAR BABB MT
MT,SCIM8,05018000,346305EA,TFX,48 51 10,113 25 01,48.85277777777778,-113.41694444444445,ST. MARY CANAL AT INTAKE NEAR BABB MT,SCIM8|05018000       |346305EA|TFX|48 51 10   |113 25 01   |ST. MARY CANAL AT INTAKE NEAR BABB MT
MT,SFLM8,06076690,16E9878A,TFX,46 47 44.88,111 10 42.80,46.7958,-111.17855555555556,SMITH RIVER NEAR FT LOGAN MT,SFLM8|06076690       |16E9878A|TFX|46 47 44.88|111 10 42.80|SMITH RIVER NEAR FT LOGAN MT
